,Unnamed: 0_x,Unnamed: 0.1,name,id,review,Unnamed: 0_y,cuisine,latitude,longitude,address,rating,review_count,price
4414,624.0,624.0,Antoinette,whNPhUyRm59jr3-3eZBaPw,say antoinette favorite place cakes tea sessions singapore always wanted visit antoinette location kind,232,indian,1.30973,103.86219,"['30 Penhas Road', 'Singapore 208188', 'Singapore']",3.5,22,$$$
4415,625.0,625.0,Antoinette,whNPhUyRm59jr3-3eZBaPw,although told place full reservations end showed table centre provided would leave,232,indian,1.30973,103.86219,"['30 Penhas Road', 'Singapore 208188', 'Singapore']",3.5,22,$$$
4440,652.0,652.0,Dashi Master Marusaya,BT0C0gTurqPiKMId1qSy7Q,times consistently good lunch menu great value money udon really tasty great place,233,indian,1.29009519725444,103.837111932809,"['86 Robertson Quay', '#01-01', 'Singapore 238245', 'Singapore']",4.0,2,$$$
4441,653.0,653.0,Dashi Master Marusaya,BT0C0gTurqPiKMId1qSy7Q,lovely meal dashi fragrant bukkake udon perfect thick bonito flakes must try hiyashi tomato also refreshing,233,indian,1.29009519725444,103.837111932809,"['86 Robertson Quay', '#01-01', 'Singapore 238245', 'Singapore']",4.0,2,$$$
4458,639.0,639.0,Kantipur Tandoori,ONzkQZ5hOWBepOc9AmB1xw,came one random night friend told knows best cheese naan country try verdict truly,234,indian,1.3100899,103.8564301,"['18 Verdun Road', '#01-01 & 02-01', 'Singapore 207280', 'Singapore']",4.0,1,$$$
4466,643.0,643.0,Creperie des Arts,isiJNMOYcE2oueoUqk-RxQ,nice little place tucked away prinsep street pretty quiet cosy arent many seats indoors may get pretty crowded,235,indian,1.29995,103.8499298,"['44 Prinsep Street', 'Singapore 188673', 'Singapore']",4.0,4,$$$
4467,644.0,644.0,Creperie des Arts,isiJNMOYcE2oueoUqk-RxQ,creperie des arts serves french style grill crepes unassuming little place prinsep right next strictly pancakes sat table,235,indian,1.29995,103.8499298,"['44 Prinsep Street', 'Singapore 188673', 'Singapore']",4.0,4,$$$
4468,645.0,645.0,Creperie des Arts,isiJNMOYcE2oueoUqk-RxQ,yummy authentic french crepes okay perhaps im entirely sure authentic hokkaido scallop crepe buckwheat galette certainly plus,235,indian,1.29995,103.8499298,"['44 Prinsep Street', 'Singapore 188673', 'Singapore']",4.0,4,$$$
4493,649.0,649.0,Blu Kouzina,5-48HYUc7HWv6NKfMAPHKQ,still simply fantastic quality coming kitchen remains consistently high always rewarded time money many,236,indian,1.30331,103.81041,"['10 Dempsey Rd', '#01-21, Dempsey Hill', 'Singapore 247700', 'Singapore']",4.5,24,$$$
4494,650.0,650.0,Blu Kouzina,5-48HYUc7HWv6NKfMAPHKQ,good greek food vegetarian friendly wide range options food freshly prepared service perfect interiors decors nice,236,indian,1.30331,103.81041,"['10 Dempsey Rd', '#01-21, Dempsey Hill', 'Singapore 247700', 'Singapore']",4.5,24,$$$
4495,651.0,651.0,Blu Kouzina,5-48HYUc7HWv6NKfMAPHKQ,teacher restaurant student would give everything came sisters birthday today service,236,indian,1.30331,103.81041,"['10 Dempsey Rd', '#01-21, Dempsey Hill', 'Singapore 247700', 'Singapore']",4.5,24,$$$
4520,654.0,654.0,Himonoya,CYubZWWJ6Aitu5kfVNCfig,gem hidden slightly sight area robertson quay second floor intended come sake sunday afternoon,237,indian,1.29198324240247,103.841383852211,"['11 Unity St', '#02-14, Robertson walk', 'Singapore', 'Singapore']",4.0,1,$$$
4529,669.0,669.0,Shabestan,7E8bLS3-3HxI-TdyfCz-_g,visited restaurant times week stay singapore enjoyed much,238,indian,1.29090920334824,103.840452549989,"['80 Mohammed Sultan Rd', '#01-13', 'The Pier at Robertson Quay', 'Singapore 239013', 'Singapore']",4.5,21,$$$
4530,670.0,670.0,Shabestan,7E8bLS3-3HxI-TdyfCz-_g,food scene amazing restaurant went friday night yummy iranian dinner heard lot place,238,indian,1.29090920334824,103.840452549989,"['80 Mohammed Sultan Rd', '#01-13', 'The Pier at Robertson Quay', 'Singapore 239013', 'Singapore']",4.5,21,$$$
4531,671.0,671.0,Shabestan,7E8bLS3-3HxI-TdyfCz-_g,think probably best persian restaurant singapore noticeably higher prices id expected quantities,238,indian,1.29090920334824,103.840452549989,"['80 Mohammed Sultan Rd', '#01-13', 'The Pier at Robertson Quay', 'Singapore 239013', 'Singapore']",4.5,21,$$$
4556,3556.0,3556.0,Wah Lok Cantonese Restaurant,Po0Qb6X_g8b00OggqtATRA,prominent cantonese restaurant town area kid used visit wah lok every family celebration occasions including dim sums however recent,239,indian,1.29607890349375,103.85253583566,"['76 Bras Basah Rd', 'Level 2', 'Singapore 189558', 'Singapore']",4.0,17,$$$
4557,3557.0,3557.0,Wah Lok Cantonese Restaurant,Po0Qb6X_g8b00OggqtATRA,overall pretty good dim sum stars similar imperial treasure although think still prefer latter nice change,239,indian,1.29607890349375,103.85253583566,"['76 Bras Basah Rd', 'Level 2', 'Singapore 189558', 'Singapore']",4.0,17,$$$
4558,3558.0,3558.0,Wah Lok Cantonese Restaurant,Po0Qb6X_g8b00OggqtATRA,check msg intoxication fix got sure please report still good ever fav yam fritter,239,indian,1.29607890349375,103.85253583566,"['76 Bras Basah Rd', 'Level 2', 'Singapore 189558', 'Singapore']",4.0,17,$$$
4562,658.0,658.0,Seoul Yummy,slnomEmGTGRii7Vn_ms8uw,know got korean restaurant week trip singapore first korean restaurant patbingsoo,240,indian,1.3042479122965,103.831890966826,"['ION Orchard', '2 Orchard Turn, #B2-22', 'Singapore 238801', 'Singapore']",4.0,2,$$$
4563,659.0,659.0,Seoul Yummy,slnomEmGTGRii7Vn_ms8uw,second visit less month best korean cooking topquality ingredients good enough relatively long menu semi fast food,240,indian,1.3042479122965,103.831890966826,"['ION Orchard', '2 Orchard Turn, #B2-22', 'Singapore 238801', 'Singapore']",4.0,2,$$$
4566,2412.0,2412.0,Seoul Yummy,yLbv_Gl8tO93vDtj7PRiOg,best friend reminiscing travels seoul suddenly thought lets go ddubboki ramen oh hey,240,indian,1.3042479122965,103.831890966826,"['ION Orchard', '2 Orchard Turn, #B2-22', 'Singapore 238801', 'Singapore']",4.0,2,$$$
4567,2413.0,2413.0,Seoul Yummy,yLbv_Gl8tO93vDtj7PRiOg,ive walked restaurant countless number times took major renovation finally take interest let,240,indian,1.3042479122965,103.831890966826,"['ION Orchard', '2 Orchard Turn, #B2-22', 'Singapore 238801', 'Singapore']",4.0,2,$$$
4568,2414.0,2414.0,Seoul Yummy,yLbv_Gl8tO93vDtj7PRiOg,simple economy korean restaurantjust go dont want fastfood kfc burger king,240,indian,1.3042479122965,103.831890966826,"['ION Orchard', '2 Orchard Turn, #B2-22', 'Singapore 238801', 'Singapore']",4.0,2,$$$
4569,2468.0,2468.0,Seoul Yummy,sbr0Fszbzdzz_E_RDMbRFw,found venue walking around mall starving finally giving aroma coming kitchen lingered hallway,240,indian,1.3042479122965,103.831890966826,"['ION Orchard', '2 Orchard Turn, #B2-22', 'Singapore 238801', 'Singapore']",4.0,2,$$$
4570,2469.0,2469.0,Seoul Yummy,sbr0Fszbzdzz_E_RDMbRFw,thanks kwave singapore korean food seems popping everywhere singapore local chain decent localized korean food,240,indian,1.3042479122965,103.831890966826,"['ION Orchard', '2 Orchard Turn, #B2-22', 'Singapore 238801', 'Singapore']",4.0,2,$$$
4571,2470.0,2470.0,Seoul Yummy,sbr0Fszbzdzz_E_RDMbRFw,youre looking great service youve come right place give kudos ladies served table definitely,240,indian,1.3042479122965,103.831890966826,"['ION Orchard', '2 Orchard Turn, #B2-22', 'Singapore 238801', 'Singapore']",4.0,2,$$$
4586,672.0,672.0,Fine Palate Cafe,VWTgoheGHeB3cR-mClIQsw,breakfast food truly time favourite nothing excites brunch menu came lunch saturday ard indoor,241,indian,1.29826,103.851181,"['51 Waterloo Street, #01-04/05', 'Singapore 187969', 'Singapore']",4.5,2,$$$
4587,673.0,673.0,Fine Palate Cafe,VWTgoheGHeB3cR-mClIQsw,heard bit fine palate never chance stop weeks ago came friend work photo shoot came,241,indian,1.29826,103.851181,"['51 Waterloo Street, #01-04/05', 'Singapore 187969', 'Singapore']",4.5,2,$$$
4602,1814.0,1814.0,Nagae,SPCdv--a6cnorGitNtbDIg,good place enjoy delicious value money japanese set lunches nagae also offers pleasant dining experience thanks quiet scenic,242,indian,1.29041,103.8350296,"['392 Havelock Road', 'Singapore 169663', 'Singapore']",4.0,7,$$$
4603,1815.0,1815.0,Nagae,SPCdv--a6cnorGitNtbDIg,honestly would suggested nagae lunch heard set lunch first one look shop location waterfront plaza,242,indian,1.29041,103.8350296,"['392 Havelock Road', 'Singapore 169663', 'Singapore']",4.0,7,$$$
4604,1816.0,1816.0,Nagae,SPCdv--a6cnorGitNtbDIg,small sushi restaurant next grand copthorne waterfront hotel seems direct neighbour venue also sushi restaurant much,242,indian,1.29041,103.8350296,"['392 Havelock Road', 'Singapore 169663', 'Singapore']",4.0,7,$$$
4632,666.0,666.0,Maharajah,WWb8UGEC1JPchY3jlp8o1A,located boat quay maharajah decent option food ambiance great considering right water great views either side,244,indian,1.28657,103.84948,"['41 Boat Quay', 'Singapore 049830', 'Singapore']",4.5,9,$$$
4633,667.0,667.0,Maharajah,WWb8UGEC1JPchY3jlp8o1A,delicious meal beautiful spot right boat quaymy colleague hankering indian food singapore business,244,indian,1.28657,103.84948,"['41 Boat Quay', 'Singapore 049830', 'Singapore']",4.5,9,$$$
4634,668.0,668.0,Maharajah,WWb8UGEC1JPchY3jlp8o1A,amazing view food delicious abit overpriced curry portion smaller rice naan extra curry rice naan,244,indian,1.28657,103.84948,"['41 Boat Quay', 'Singapore 049830', 'Singapore']",4.5,9,$$$
4656,660.0,660.0,Coq & Balls,Q2tEM5PXNjBTHl2UA4NleA,fun find coming neighborhood tiong bahru youre unfamiliar area getting seem bit tricky location bit,245,indian,1.2852519,103.8292453,"['6 Kim Tian Rd', 'Kai Fook Mansion', 'Singapore 169246', 'Singapore']",4.0,13,$$$
4657,661.0,661.0,Coq & Balls,Q2tEM5PXNjBTHl2UA4NleA,pretty cool bar middle tiong bahru thursdays fridays usually packed mixture expats locals bar also shows certain,245,indian,1.2852519,103.8292453,"['6 Kim Tian Rd', 'Kai Fook Mansion', 'Singapore 169246', 'Singapore']",4.0,13,$$$
4658,662.0,662.0,Coq & Balls,Q2tEM5PXNjBTHl2UA4NleA,great bar bartenders serious cocktails make point get right theyre also rad talk michael,245,indian,1.2852519,103.8292453,"['6 Kim Tian Rd', 'Kai Fook Mansion', 'Singapore 169246', 'Singapore']",4.0,13,$$$
4683,680.0,680.0,Fish Mart Sakuraya,ZUOsaHVpSGBdL1h_8IAlJg,cute japanese mart basic convenience store foods theres also full blown restaurant back place lot,246,indian,1.28925265068146,103.805550729182,"['370A Alexandra Road', 'Singapore 159954', 'Singapore']",4.5,4,$$$
4684,681.0,681.0,Fish Mart Sakuraya,ZUOsaHVpSGBdL1h_8IAlJg,another branch sakuraya fish market usually eat restaurant also sell japanese groceriesthe highlight place,246,indian,1.28925265068146,103.805550729182,"['370A Alexandra Road', 'Singapore 159954', 'Singapore']",4.5,4,$$$
4685,682.0,682.0,Fish Mart Sakuraya,ZUOsaHVpSGBdL1h_8IAlJg,look sky market restaurant dunnoboth maybe go pick fish take home slice eat eat,246,indian,1.28925265068146,103.805550729182,"['370A Alexandra Road', 'Singapore 159954', 'Singapore']",4.5,4,$$$
4762,677.0,677.0,Bincho at Hua Bee,pvgfvEwMJmtWkKBjEkGonQ,missing japan tooso friend returning singapore sojourn germany recommended spot dinner catchup low,249,indian,1.283741,103.8304062,"['78 Moh Guan Terrace', '#01-19', 'Singapore 162078', 'Singapore']",4.0,15,$$$
4763,678.0,678.0,Bincho at Hua Bee,pvgfvEwMJmtWkKBjEkGonQ,dinner last night liked atmosphere least wkd seatings one one starting la,249,indian,1.283741,103.8304062,"['78 Moh Guan Terrace', '#01-19', 'Singapore 162078', 'Singapore']",4.0,15,$$$
4764,679.0,679.0,Bincho at Hua Bee,pvgfvEwMJmtWkKBjEkGonQ,review new outlet dempsey hard find tucked behind min jian dempsey restaurant means binsho bin food,249,indian,1.283741,103.8304062,"['78 Moh Guan Terrace', '#01-19', 'Singapore 162078', 'Singapore']",4.0,15,$$$
4816,692.0,692.0,Shang Palace,qRn-QYm6WpqgNMRQMMnWzw,food absolutely delicious fresh way priced dim sum im used paying dim sum restaurant nice elegant,251,indian,1.311153,103.826574,"['22 Orange Grove Rd', 'Singapore 258350', 'Singapore']",4.5,7,$$$
4817,693.0,693.0,Shang Palace,qRn-QYm6WpqgNMRQMMnWzw,place definitely high end needs reservations service impeccable food outstanding lives name could tell,251,indian,1.311153,103.826574,"['22 Orange Grove Rd', 'Singapore 258350', 'Singapore']",4.5,7,$$$
4818,694.0,694.0,Shang Palace,qRn-QYm6WpqgNMRQMMnWzw,since chef mok kit keung mich star shang hk revamped cooking menu become one best chinese restaurants singapore many,251,indian,1.311153,103.826574,"['22 Orange Grove Rd', 'Singapore 258350', 'Singapore']",4.5,7,$$$
4846,686.0,686.0,SushiAirways Sushibar,G0F3tLI-oQjQHxPYDmjy9A,stopped light late dinner liked whole decor flight theme really went detail menu flight manual lights like,252,indian,1.30117,103.8597336,"['20A Baghdad Street', 'Singapore 199659', 'Singapore']",3.5,7,$$$
4847,687.0,687.0,SushiAirways Sushibar,G0F3tLI-oQjQHxPYDmjy9A,food good way pricey worth go lunch lunch special offer visited evening offer wasnt,252,indian,1.30117,103.8597336,"['20A Baghdad Street', 'Singapore 199659', 'Singapore']",3.5,7,$$$
4848,688.0,688.0,SushiAirways Sushibar,G0F3tLI-oQjQHxPYDmjy9A,happened sushi airways sheer luck town couple weeks holed across street pan pacific suites figured would,252,indian,1.30117,103.8597336,"['20A Baghdad Street', 'Singapore 199659', 'Singapore']",3.5,7,$$$
4873,629.0,629.0,Paddy Hills,DbvK2HkM-wxbEQxlmczAlQ,went girlfriends last saturday look instagram posts menu noticed popular black ink dishes,253,indian,1.28082,103.78702,"['38 South Buona Vista Rd', 'Singapore 118164', 'Singapore']",4.0,15,$$$
4874,630.0,630.0,Paddy Hills,DbvK2HkM-wxbEQxlmczAlQ,getting completely lost looking place surprised find super cute cafe middle almost nowhere discreetly hidden,253,indian,1.28082,103.78702,"['38 South Buona Vista Rd', 'Singapore 118164', 'Singapore']",4.0,15,$$$
4875,631.0,631.0,Paddy Hills,DbvK2HkM-wxbEQxlmczAlQ,paddy hills offers unique dishes hip environment west side singapore get crowded weekends would recommend coming,253,indian,1.28082,103.78702,"['38 South Buona Vista Rd', 'Singapore 118164', 'Singapore']",4.0,15,$$$
4897,1838.0,1838.0,Sushi Jin,EuzMCZ0nvgs3twBPFs2xMw,always make time sushi jin whenever singapore one best japanese restaurant town love fresh sushi also,254,indian,1.31212,103.8541565,"['1 Farrer Park Station Road', '#01-11/12, Owen Link', 'Singapore 217562', 'Singapore']",4.0,8,$$$
4898,1839.0,1839.0,Sushi Jin,EuzMCZ0nvgs3twBPFs2xMw,price point little high ingredients high quality chefs skills point service also friendly attentive worth,254,indian,1.31212,103.8541565,"['1 Farrer Park Station Road', '#01-11/12, Owen Link', 'Singapore 217562', 'Singapore']",4.0,8,$$$
4899,1840.0,1840.0,Sushi Jin,EuzMCZ0nvgs3twBPFs2xMw,local sushi place helmed chinese sushi chefsfood decent price reasonable,254,indian,1.31212,103.8541565,"['1 Farrer Park Station Road', '#01-11/12, Owen Link', 'Singapore 217562', 'Singapore']",4.0,8,$$$
4900,646.0,646.0,Employees Only,ZczNcUtGw7s2n25W2AlncQ,great vibe happened chance upon looking another place couldnt find first weekend music allowed,255,indian,1.28214,103.84752,"['112 Amoy St', 'Singapore 069932', 'Singapore']",4.5,18,$$$
4901,647.0,647.0,Employees Only,ZczNcUtGw7s2n25W2AlncQ,eo definitely worth trip youre craft cocktails good times mixologists legit though think menu items may better,255,indian,1.28214,103.84752,"['112 Amoy St', 'Singapore 069932', 'Singapore']",4.5,18,$$$
4902,648.0,648.0,Employees Only,ZczNcUtGw7s2n25W2AlncQ,went team dinner defiantly call advance least couple days got order prefix menu food great,255,indian,1.28214,103.84752,"['112 Amoy St', 'Singapore 069932', 'Singapore']",4.5,18,$$$
4924,699.0,699.0,Super Siam Thai Restaurant,2EHLiUTODECk0Awp1vhu8Q,strangely food obsessed city way many middling right terrible thai places singapore place along purvis,256,thai,1.28786910092303,103.84319319567,"['20 Havelock Rd', '#01-12, Central Square', 'Singapore 059765', 'Singapore']",4.0,3,$
4925,700.0,700.0,Super Siam Thai Restaurant,2EHLiUTODECk0Awp1vhu8Q,first thing youll notice place seems two names printed super siam thai restaurant menus says sky,256,thai,1.28786910092303,103.84319319567,"['20 Havelock Rd', '#01-12, Central Square', 'Singapore 059765', 'Singapore']",4.0,3,$
4926,701.0,701.0,Super Siam Thai Restaurant,2EHLiUTODECk0Awp1vhu8Q,sky lucks cafe located near ministry manpower building serves one authentic tasting thai food ever tried singapore,256,thai,1.28786910092303,103.84319319567,"['20 Havelock Rd', '#01-12, Central Square', 'Singapore 059765', 'Singapore']",4.0,3,$
4927,364.0,364.0,Jai's Thai-Vientiane Cuisine,ARA8-MFwrjgHmPcYJ4kz4g,absolutely best thai food neighborhood coffee shops prices reasonable portions huge big diet people first time,257,thai,1.33296,103.89413,"['33 Ubi Ave 3', '#01-08', 'Vertex', 'Singapore 408868', 'Singapore']",5.0,1,$
4936,702.0,702.0,Thai Boat Noodles @BaanThai Kitchen,4AyLDuIhGdpDr1zGulv8pA,ķi tried several boat noodles stalls curb craving thai boat noodles taste didnt come close bangkoki,258,thai,1.30287165103431,103.865302316844,"['Golden Mile Complex', 'Singapore 199588', 'Singapore']",5.0,3,$
4937,703.0,703.0,Thai Boat Noodles @BaanThai Kitchen,4AyLDuIhGdpDr1zGulv8pA,thai boat noodles singapore thailand im told ive never thailand given pigs blood,258,thai,1.30287165103431,103.865302316844,"['Golden Mile Complex', 'Singapore 199588', 'Singapore']",5.0,3,$
4938,704.0,704.0,Thai Boat Noodles @BaanThai Kitchen,4AyLDuIhGdpDr1zGulv8pA,im back bang kicking things star review ofa boat noodles stall lets retrace got couple months back,258,thai,1.30287165103431,103.865302316844,"['Golden Mile Complex', 'Singapore 199588', 'Singapore']",5.0,3,$
4939,705.0,705.0,Jai Thai,4PBHeLrPwUftXTjfw5ysew,friendly service missed special combination willing change order im grateful theres sufficient staff meet,259,thai,1.29627,103.85532,"['27 Purvis St', 'Singapore 188604', 'Singapore']",4.0,21,$
4940,706.0,706.0,Jai Thai,4PBHeLrPwUftXTjfw5ysew,many different options vegetarian im glad vegetarian section menu service quick using ipads table,259,thai,1.29627,103.85532,"['27 Purvis St', 'Singapore 188604', 'Singapore']",4.0,21,$
4941,707.0,707.0,Jai Thai,4PBHeLrPwUftXTjfw5ysew,problems found napkins good service food delicious hard find good inexpensive thai food restaurants singaporewe,259,thai,1.29627,103.85532,"['27 Purvis St', 'Singapore 188604', 'Singapore']",4.0,21,$
4942,717.0,717.0,Jai Thai,PA4Ifoo7h5Ihm76_XEZIfw,eat need get something premimpin location parking bad dont pay attention bound get fine ambience aircon,259,thai,1.29627,103.85532,"['27 Purvis St', 'Singapore 188604', 'Singapore']",4.0,21,$
4943,718.0,718.0,Jai Thai,PA4Ifoo7h5Ihm76_XEZIfw,nicely located within parents neighborhood ive seen thai eatery grow since humble beginnings brand name outlets,259,thai,1.29627,103.85532,"['27 Purvis St', 'Singapore 188604', 'Singapore']",4.0,21,$
4944,719.0,719.0,Jai Thai,PA4Ifoo7h5Ihm76_XEZIfw,regular fan visit place mostly sundays restaurant tucked really quiet neighborhood drive easy,259,thai,1.29627,103.85532,"['27 Purvis St', 'Singapore 188604', 'Singapore']",4.0,21,$
4945,708.0,708.0,Nakhon Kitchen,kDlakqhueliPOad3CDNE_A,always line establishment good thai food affordable prices wonder many willing que wait,260,thai,1.31031141538523,103.794988019353,"['27A Lorong Liput', 'Holland Village', 'Singapore 277738', 'Singapore']",3.5,26,$
4946,709.0,709.0,Nakhon Kitchen,kDlakqhueliPOad3CDNE_A,us queued outlet opened business yet treated like invisible rude woman waved staff showed,260,thai,1.31031141538523,103.794988019353,"['27A Lorong Liput', 'Holland Village', 'Singapore 277738', 'Singapore']",3.5,26,$
4947,710.0,710.0,Nakhon Kitchen,kDlakqhueliPOad3CDNE_A,im gradually getting used waiting line food typically amused long line wow worth wait best,260,thai,1.31031141538523,103.794988019353,"['27A Lorong Liput', 'Holland Village', 'Singapore 277738', 'Singapore']",3.5,26,$
4948,734.0,734.0,Nakhon Kitchen,cSrayPkbfgDt57e-AOmfKw,hands favorite thai food place singapore prices amazing quality food get average noodle dishes eg,260,thai,1.31031141538523,103.794988019353,"['27A Lorong Liput', 'Holland Village', 'Singapore 277738', 'Singapore']",3.5,26,$
4949,735.0,735.0,Nakhon Kitchen,cSrayPkbfgDt57e-AOmfKw,ive heard many great things outlet always queue area queue sit eatin,260,thai,1.31031141538523,103.794988019353,"['27A Lorong Liput', 'Holland Village', 'Singapore 277738', 'Singapore']",3.5,26,$
4950,736.0,736.0,Nakhon Kitchen,cSrayPkbfgDt57e-AOmfKw,friend introduced thai restaurant remembered long queue back long waited almost duration football,260,thai,1.31031141538523,103.794988019353,"['27A Lorong Liput', 'Holland Village', 'Singapore 277738', 'Singapore']",3.5,26,$
4951,780.0,780.0,Nakhon Kitchen,ap283KQDFCN-5DTbRioFNA,ive driven place several times seen queues weekends tried make telephone reservation told come queue,260,thai,1.31031141538523,103.794988019353,"['27A Lorong Liput', 'Holland Village', 'Singapore 277738', 'Singapore']",3.5,26,$
4952,930.0,930.0,Nakhon Kitchen,nOFQHAuxWSO64UGmtuO60Q,general rule thai restaurants theres picture king must good probably manned real thai people place,260,thai,1.31031141538523,103.794988019353,"['27A Lorong Liput', 'Holland Village', 'Singapore 277738', 'Singapore']",3.5,26,$
4953,931.0,931.0,Nakhon Kitchen,nOFQHAuxWSO64UGmtuO60Q,decor simple food affordable good crowded weekday lunch weekend dinner good come sunday lunchmy,260,thai,1.31031141538523,103.794988019353,"['27A Lorong Liput', 'Holland Village', 'Singapore 277738', 'Singapore']",3.5,26,$
4954,932.0,932.0,Nakhon Kitchen,nOFQHAuxWSO64UGmtuO60Q,im definitely fan place good food reasonable prices ordered tom yam soup green curry honey chicken kang kong thai style,260,thai,1.31031141538523,103.794988019353,"['27A Lorong Liput', 'Holland Village', 'Singapore 277738', 'Singapore']",3.5,26,$
4955,711.0,711.0,Mei Toy Thai Food,LBnoxK0AsIlCGuob0FnMMA,since close hotel decided pop bitei would recommend nice environment waitresses friendly took order quickly food,261,thai,1.31168477174686,103.87585580349,"['82, Geylang Rd Lorong 4', 'Singapore 389252', 'Singapore']",4.0,2,$
4956,712.0,712.0,Mei Toy Thai Food,LBnoxK0AsIlCGuob0FnMMA,authentic good value food happy place near eat regularly papaya salad larb gai steamed fish excellent issue,261,thai,1.31168477174686,103.87585580349,"['82, Geylang Rd Lorong 4', 'Singapore 389252', 'Singapore']",4.0,2,$
4957,714.0,714.0,Le Wu Cafe,8HjUivQ9od_978vJ4crPDA,papaya salad starshas spiciest ive singapore way many chili padi seeds couldnt finish definitely asking,262,thai,1.32293323856371,103.811889751633,"['551 Bukit Timah Road', 'Singapore 269692', 'Singapore']",4.0,6,$
4958,715.0,715.0,Le Wu Cafe,8HjUivQ9od_978vJ4crPDA,great price tom kha gai coconut soup incredible also go iced thai tea refreshing hot day,262,thai,1.32293323856371,103.811889751633,"['551 Bukit Timah Road', 'Singapore 269692', 'Singapore']",4.0,6,$
4959,716.0,716.0,Le Wu Cafe,8HjUivQ9od_978vJ4crPDA,silver service great tasty food road cheap cheerful authentic thai flavours see eating ordering take,262,thai,1.32293323856371,103.811889751633,"['551 Bukit Timah Road', 'Singapore 269692', 'Singapore']",4.0,6,$
4960,720.0,720.0,Sweet Basil,xMvrhAXvKwq0spouR9mqLQ,tiny shop holds pax enjoy authentic thai favourites food price ranges items menu,263,thai,1.29102528044598,103.851201416204,"['1 Coleman Street', '#02-07, The Adelphi', 'Singapore 179803', 'Singapore']",4.0,1,$
4961,721.0,721.0,Maggie Thai & Chinese,Y4-xxNWQ2Tku4zM_u7qMOA,first time singapore first meal checking rooms food great wish variety thai dishes,264,thai,1.29772,103.8565292,"['1 Liang Seah Street', '#01-01/02 Liang Seah Place', 'Singapore 189022', 'Singapore']",4.0,9,$
4962,722.0,722.0,Maggie Thai & Chinese,Y4-xxNWQ2Tku4zM_u7qMOA,liang seah street closed vehicle traffic fridays saturdays sundays pm midnight establishments along street bring,264,thai,1.29772,103.8565292,"['1 Liang Seah Street', '#01-01/02 Liang Seah Place', 'Singapore 189022', 'Singapore']",4.0,9,$
4963,723.0,723.0,Maggie Thai & Chinese,Y4-xxNWQ2Tku4zM_u7qMOA,nice place thai chinese rice wine chicken tasted like distant ancestor american chinese sweet sour chicken glopped,264,thai,1.29772,103.8565292,"['1 Liang Seah Street', '#01-01/02 Liang Seah Place', 'Singapore 189022', 'Singapore']",4.0,9,$
4964,727.0,727.0,Soi 19 Thai Wanton Mee,aahXuRPlzi4GvSCf3K6GPg,stall located inside coffeeshop well known thai style wanton noodles attracted long queue today raining quite,265,thai,1.37669,103.84117,"['151 Ang Mo Kio Ave 5', 'Singapore 560151', 'Singapore']",4.0,7,$
4965,728.0,728.0,Soi 19 Thai Wanton Mee,aahXuRPlzi4GvSCf3K6GPg,guest country rely coworkers help find best local places eat one best lunches ive soup,265,thai,1.37669,103.84117,"['151 Ang Mo Kio Ave 5', 'Singapore 560151', 'Singapore']",4.0,7,$
4966,729.0,729.0,Soi 19 Thai Wanton Mee,aahXuRPlzi4GvSCf3K6GPg,people always asking whether tried soi thai wanton mee since right hood even within walking distance braved,265,thai,1.37669,103.84117,"['151 Ang Mo Kio Ave 5', 'Singapore 560151', 'Singapore']",4.0,7,$
4967,731.0,731.0,Nana Thai,u3CVFx8M1uSn_nNfJuwQTQ,popped tuesday night nofrills thai place get dirty right smack golden mile complex bars thai,266,thai,1.30308,103.8650894,"['5001 Beach Road', 'Golden Mile Complex #01-51/52/66C', 'Singapore 199588', 'Singapore']",4.0,6,$
4968,732.0,732.0,Nana Thai,u3CVFx8M1uSn_nNfJuwQTQ,hey people love thai food try nana thai serve authentic thai cuisine valuable priceits located level,266,thai,1.30308,103.8650894,"['5001 Beach Road', 'Golden Mile Complex #01-51/52/66C', 'Singapore 199588', 'Singapore']",4.0,6,$
4969,733.0,733.0,Nana Thai,u3CVFx8M1uSn_nNfJuwQTQ,fuss free thai food stall tuck golden mile complex pricing reasonable generous portion ordered cold,266,thai,1.30308,103.8650894,"['5001 Beach Road', 'Golden Mile Complex #01-51/52/66C', 'Singapore 199588', 'Singapore']",4.0,6,$
