,Unnamed: 0_x,Unnamed: 0.1,name,id,review,Unnamed: 0_y,cuisine,latitude,longitude,address,rating,review_count,price
6185,1332.0,1332.0,Perbacco,AG1AvSmHT1G6rEpZACiquQ,typical hot new place town first saturday dinner packedkudos staff booked table arrivedthey,504,italian,1.27803,103.8423462,"['20 Craig Rd', '#01-03', 'Singapore 089692', 'Singapore']",4.0,3,$$$
6186,1333.0,1333.0,Perbacco,AG1AvSmHT1G6rEpZACiquQ,delicious food lamb cooked perfectly pasta one best singapore attentive helpful staff come back,504,italian,1.27803,103.8423462,"['20 Craig Rd', '#01-03', 'Singapore 089692', 'Singapore']",4.0,3,$$$
6187,1334.0,1334.0,Perbacco,AG1AvSmHT1G6rEpZACiquQ,one best italian restaurant ever italian seen food authentic italian service high,504,italian,1.27803,103.8423462,"['20 Craig Rd', '#01-03', 'Singapore 089692', 'Singapore']",4.0,3,$$$
6188,1335.0,1335.0,Limoncello Pizza & Grill,0fN6LmN1wkYu_M4zYlAdNQ,booked dinner sunday night food came wonderful flavors quantities loved first visit months ago pizza,505,italian,1.29093,103.83668,"['95 Robertson Quay', '#01-19/20', 'Rivergate', 'Singapore 238256', 'Singapore']",3.0,12,$$$
6189,1336.0,1336.0,Limoncello Pizza & Grill,0fN6LmN1wkYu_M4zYlAdNQ,tldr clear cooking skills fantastic location questionable winewe walked past restaurant years love location thought would,505,italian,1.29093,103.83668,"['95 Robertson Quay', '#01-19/20', 'Rivergate', 'Singapore 238256', 'Singapore']",3.0,12,$$$
6190,1337.0,1337.0,Limoncello Pizza & Grill,0fN6LmN1wkYu_M4zYlAdNQ,dont waste time bushleague operation delivery order suddenly cancelled one hour placing order,505,italian,1.29093,103.83668,"['95 Robertson Quay', '#01-19/20', 'Rivergate', 'Singapore 238256', 'Singapore']",3.0,12,$$$
6191,1338.0,1338.0,Aura,UvNp68wVbRCuJnucZ_sPsQ,aura located new national gallery singapore besides quaint location italian restaurant serves wide array wine complements,506,italian,1.2897045,103.8512862,"[""1 St Andrew's Rd"", '#06-02', 'Singapore 178957', 'Singapore']",3.5,21,$$$
6192,1339.0,1339.0,Aura,UvNp68wVbRCuJnucZ_sPsQ,used burrples one one otherwise terribly overpriced given food doesnt taste good wouldnt even pay half price portions,506,italian,1.2897045,103.8512862,"[""1 St Andrew's Rd"", '#06-02', 'Singapore 178957', 'Singapore']",3.5,21,$$$
6193,1340.0,1340.0,Aura,UvNp68wVbRCuJnucZ_sPsQ,restaurant located going open national gallery singapore opened beppe de vito one behind il lido sentosa,506,italian,1.2897045,103.8512862,"[""1 St Andrew's Rd"", '#06-02', 'Singapore 178957', 'Singapore']",3.5,21,$$$
6194,1341.0,1341.0,Cicheti,k9w2tAgGlD-lwQue7KP5qA,good service good food ambience ask really issue place per restaurant area parking,507,italian,1.3017,103.85997,"['52 Kandahar St', 'Singapore 198901', 'Singapore']",4.0,34,$$$
6195,1342.0,1342.0,Cicheti,k9w2tAgGlD-lwQue7KP5qA,based rave reviews brickoven pizza finally got chance visit cicheti definitely call make reservation get,507,italian,1.3017,103.85997,"['52 Kandahar St', 'Singapore 198901', 'Singapore']",4.0,34,$$$
6196,1343.0,1343.0,Cicheti,k9w2tAgGlD-lwQue7KP5qA,came sisters bday dinner left disappointed chosen dine cicheti wanted satisfy craving squid,507,italian,1.3017,103.85997,"['52 Kandahar St', 'Singapore 198901', 'Singapore']",4.0,34,$$$
6197,1344.0,1344.0,Petes's Place,Egkl60a0DcH7n87Pr9neqg,came petes place lunch eating asian food couple days thought wed try place informed,508,italian,1.3064382,103.83333,"['Grand Hyatt Singapore', '10 Scotts Road', 'Singapore 228211', 'Singapore']",3.5,13,$$$
6198,1345.0,1345.0,Petes's Place,Egkl60a0DcH7n87Pr9neqg,recent trip singapore went place twice even though wasnt staying grand hyatt nearby hotelits basement,508,italian,1.3064382,103.83333,"['Grand Hyatt Singapore', '10 Scotts Road', 'Singapore 228211', 'Singapore']",3.5,13,$$$
6199,1346.0,1346.0,Petes's Place,Egkl60a0DcH7n87Pr9neqg,throwback italian dining scene singapore grim dark décor low ceiling noisy muzak nondescript music food,508,italian,1.3064382,103.83333,"['Grand Hyatt Singapore', '10 Scotts Road', 'Singapore 228211', 'Singapore']",3.5,13,$$$
6200,1353.0,1353.0,Pizza Fabbrica,ywslAH5g0TByaUCkif5KXA,came friday night pleasantly surprised quality pizzas felt wildfires though didnt confirm pleasant chewy,509,italian,1.30101403603432,103.860021059622,"['69/70 Bussorah Street', 'Singapore 199483', 'Singapore']",4.0,12,$$$
6201,1354.0,1354.0,Pizza Fabbrica,ywslAH5g0TByaUCkif5KXA,ive ordered pizza fabbrica ubereats struggle finding good pizza singapore would likely take leadcooked,509,italian,1.30101403603432,103.860021059622,"['69/70 Bussorah Street', 'Singapore 199483', 'Singapore']",4.0,12,$$$
6202,1355.0,1355.0,Pizza Fabbrica,ywslAH5g0TByaUCkif5KXA,arrived late places alley closed shop night tried luck asked whether still open served,509,italian,1.30101403603432,103.860021059622,"['69/70 Bussorah Street', 'Singapore 199483', 'Singapore']",4.0,12,$$$
6203,1350.0,1350.0,Atmastel,sZ9xZqgex0qhfSdNLth5ZQ,restaurant located near mrt station restaurant stylish modern decoration although tables indoor,510,italian,1.29441188243389,103.855544017197,"['26 Beach Rd', '#B1-22', 'South Beach Avenue', 'Singapore 189768', 'Singapore']",3.5,4,$$$
6204,1351.0,1351.0,Atmastel,sZ9xZqgex0qhfSdNLth5ZQ,lunch surprised solid performance authentic italian food buttata starter dont pick calamari zucchini,510,italian,1.29441188243389,103.855544017197,"['26 Beach Rd', '#B1-22', 'South Beach Avenue', 'Singapore 189768', 'Singapore']",3.5,4,$$$
6205,1352.0,1352.0,Atmastel,sZ9xZqgex0qhfSdNLth5ZQ,pizza would midrange chain back us would cost bucks carryout special soggy crust decent char bland sauce,510,italian,1.29441188243389,103.855544017197,"['26 Beach Rd', '#B1-22', 'South Beach Avenue', 'Singapore 189768', 'Singapore']",3.5,4,$$$
6206,1347.0,1347.0,Zafferano Restaurant,0hGE_UiUMAcF3PABcE-M4Q,havent heard good things place friend wanted check surprisingly good lobster pasta,511,italian,1.28276212731736,103.853022060482,"['10 Collyer Quay', '#43-01', 'Ocean Financial Centre', 'Singapore 049315', 'Singapore']",3.0,16,$$$
6207,1348.0,1348.0,Zafferano Restaurant,0hGE_UiUMAcF3PABcE-M4Q,company took us dinner spot first night workshop selected menu us limited could order,511,italian,1.28276212731736,103.853022060482,"['10 Collyer Quay', '#43-01', 'Ocean Financial Centre', 'Singapore 049315', 'Singapore']",3.0,16,$$$
6208,1349.0,1349.0,Zafferano Restaurant,0hGE_UiUMAcF3PABcE-M4Q,restaurant week reviewright heart cbd get spectacular view marina bay areaive always skeptical restaurant week,511,italian,1.28276212731736,103.853022060482,"['10 Collyer Quay', '#43-01', 'Ocean Financial Centre', 'Singapore 049315', 'Singapore']",3.0,16,$$$
6215,1362.0,1362.0,Rubato,sQ09FSZ6KmjtZOzrgcWO2A,evian water pricey served without ordering food wise ok although portion small even small eater,513,italian,1.3311847181112,103.806992320822,"['12 Greenwood Ave', 'Singapore 289204', 'Singapore']",4.0,12,$$$
6216,1363.0,1363.0,Rubato,sQ09FSZ6KmjtZOzrgcWO2A,lunch set warned set lunch portions small started cioppino stars seafood didnt taste fresh,513,italian,1.3311847181112,103.806992320822,"['12 Greenwood Ave', 'Singapore 289204', 'Singapore']",4.0,12,$$$
6217,1364.0,1364.0,Rubato,sQ09FSZ6KmjtZOzrgcWO2A,absolutely meh service bland food ive experienced awhile im sure owner heshe business pretending,513,italian,1.3311847181112,103.806992320822,"['12 Greenwood Ave', 'Singapore 289204', 'Singapore']",4.0,12,$$$
6225,1378.0,1378.0,Bruno's Bistrot,PfNltJdDVxf0Q34BigAnDQ,quality pizza wasnt good prices charge dishes ok nothing super special,515,italian,1.31213,103.91116,"['201 Telok Kurau Rd', '#01-06, Kurau Court', 'Singapore 423910', 'Singapore']",4.0,5,$$$
6226,1379.0,1379.0,Bruno's Bistrot,PfNltJdDVxf0Q34BigAnDQ,next door amazing alaska guys thats different review brunos bistrot counted serve delicious italian food reminds,515,italian,1.31213,103.91116,"['201 Telok Kurau Rd', '#01-06, Kurau Court', 'Singapore 423910', 'Singapore']",4.0,5,$$$
6227,1380.0,1380.0,Bruno's Bistrot,PfNltJdDVxf0Q34BigAnDQ,food excellent pasta pizzas disappoint favorite burrata parma ham angel hair pasta truffles,515,italian,1.31213,103.91116,"['201 Telok Kurau Rd', '#01-06, Kurau Court', 'Singapore 423910', 'Singapore']",4.0,5,$$$
6228,1369.0,1369.0,Prego,z3zGql0n8YV9HCtUu6Be2w,still old time fave place holds memories dates universities family dinners well time spent started,516,italian,1.293827,103.854009,"['80 Bras Basah Rd', 'Level 1', 'Singapore 189560', 'Singapore']",3.5,28,$$$
6229,1370.0,1370.0,Prego,z3zGql0n8YV9HCtUu6Be2w,nice italian place fairmont really like tiramisu right balance boozy coffee flavors dishes also decent,516,italian,1.293827,103.854009,"['80 Bras Basah Rd', 'Level 1', 'Singapore 189560', 'Singapore']",3.5,28,$$$
6230,1371.0,1371.0,Prego,z3zGql0n8YV9HCtUu6Be2w,came impromptu lunch hardly visit raffles city shopping centre home surprised changed past decade,516,italian,1.293827,103.854009,"['80 Bras Basah Rd', 'Level 1', 'Singapore 189560', 'Singapore']",3.5,28,$$$
6231,1372.0,1372.0,DOP Mozzarella Bar,QpS1TiMlcBbtTNI34eeKsA,quite nice location near riverside area robertson quay saw close tomy hotel decided nice lunch service fast,517,italian,1.29026,103.83919,"['60 Robertson Quay', '#01-04A The Quayside', 'Singapore 238252', 'Singapore']",4.0,8,$$$
6232,1373.0,1373.0,DOP Mozzarella Bar,QpS1TiMlcBbtTNI34eeKsA,robertson quay area full fun spots eat mozzarella bar great choice especially like little cheese diet outdoor,517,italian,1.29026,103.83919,"['60 Robertson Quay', '#01-04A The Quayside', 'Singapore 238252', 'Singapore']",4.0,8,$$$
6233,1374.0,1374.0,DOP Mozzarella Bar,QpS1TiMlcBbtTNI34eeKsA,finally new italian place robertson quayamazing appetizers course mozzarella based name stays got pasta sciagliatelli cacio,517,italian,1.29026,103.83919,"['60 Robertson Quay', '#01-04A The Quayside', 'Singapore 238252', 'Singapore']",4.0,8,$$$
6234,1375.0,1375.0,Pizzeria L'Operetta,BtCyZ9-_PoC4LJEO9aLucw,like people give free stuff popped tuesday wasnt feeling hot ordered take away simple margarita pizza,518,italian,1.275,103.8445206,"['Icon Village #01-78-81', '12 Gopeng Street', 'Singapore 078877', 'Singapore']",3.0,13,$$$
6235,1376.0,1376.0,Pizzeria L'Operetta,BtCyZ9-_PoC4LJEO9aLucw,way overpriced offer ordered pizza spaghetti bolognese cheese wasnt attached pizza crust hot,518,italian,1.275,103.8445206,"['Icon Village #01-78-81', '12 Gopeng Street', 'Singapore 078877', 'Singapore']",3.0,13,$$$
6236,1377.0,1377.0,Pizzeria L'Operetta,BtCyZ9-_PoC4LJEO9aLucw,pizzas tasty prices outrageousthe average pizza around id say inch diameter pizza sorry used,518,italian,1.275,103.8445206,"['Icon Village #01-78-81', '12 Gopeng Street', 'Singapore 078877', 'Singapore']",3.0,13,$$$
6237,1381.0,1381.0,Baci Baci,X_ALxaxEOo1z2GU0rsDODw,love everything place pretty expensive well worth special occasion visit,519,italian,1.36453702795297,103.870035074651,"['27 Lichfield Rd', 'Singapore 556847', 'Singapore']",4.5,6,$$$
6238,1382.0,1382.0,Baci Baci,X_ALxaxEOo1z2GU0rsDODw,three times definitely one best italian restaurants singapore homely atmosphere staff treat customers like family superb,519,italian,1.36453702795297,103.870035074651,"['27 Lichfield Rd', 'Singapore 556847', 'Singapore']",4.5,6,$$$
6239,1383.0,1383.0,Baci Baci,X_ALxaxEOo1z2GU0rsDODw,neighborhood italian serangoon absolutely rustic home cooked italian extensive menu food wine great traditional choices start,519,italian,1.36453702795297,103.870035074651,"['27 Lichfield Rd', 'Singapore 556847', 'Singapore']",4.5,6,$$$
6240,1408.0,1408.0,Latteria Mozzarella Bar,CTYFfHq1SWFyCeJ-KyIgOQ,genuine italian staff great terrace al fresco dinnerdont miss awesome pumpkin mac cheese actually comes real pumpkin,520,italian,1.27859,103.8429031,"['40 Duxton Hill', 'Singapore 089618', 'Singapore']",4.0,31,$$$
6241,1409.0,1409.0,Latteria Mozzarella Bar,CTYFfHq1SWFyCeJ-KyIgOQ,nice italian spot nestled duxton hill leafy spacious outdoor dining area ideal dinner way hot lunch came,520,italian,1.27859,103.8429031,"['40 Duxton Hill', 'Singapore 089618', 'Singapore']",4.0,31,$$$
6242,1410.0,1410.0,Latteria Mozzarella Bar,CTYFfHq1SWFyCeJ-KyIgOQ,without doubt best pumpkin mac cheese ever know latteria known cheese incredibly full flavor,520,italian,1.27859,103.8429031,"['40 Duxton Hill', 'Singapore 089618', 'Singapore']",4.0,31,$$$
6243,1384.0,1384.0,La Braceria,jpolZq8uBgP2N8YAPhvt_w,key points noted service restaurant downfall visit meats either undercooked overcooked made,521,italian,1.33164,103.8070526,"['5 Greendale Ave', 'Hillcrest', 'Singapore 289501', 'Singapore']",3.5,8,$$$
6244,1385.0,1385.0,La Braceria,jpolZq8uBgP2N8YAPhvt_w,nice cosy location away city food good one best crabmeat liguine anywhere singapore good wine selection,521,italian,1.33164,103.8070526,"['5 Greendale Ave', 'Hillcrest', 'Singapore 289501', 'Singapore']",3.5,8,$$$
6245,1386.0,1386.0,La Braceria,jpolZq8uBgP2N8YAPhvt_w,overall pleasant dining experience great ambiance date night dessert mascarpone cheesecake triumphs mascarpone cheesecake,521,italian,1.33164,103.8070526,"['5 Greendale Ave', 'Hillcrest', 'Singapore 289501', 'Singapore']",3.5,8,$$$
6246,1390.0,1390.0,Cacio e Pepe Cucina Italiano,1qfnoJTs78uQ0UnM0-hYPQ,meh close us highly recommended made trek food okay genuinely mean wasnt bad wasnt,522,italian,1.35779616390878,103.760363020143,"['3 Chu Lin Road', 'Singapore 669890', 'Singapore']",3.5,3,$$$
6247,1391.0,1391.0,Cacio e Pepe Cucina Italiano,1qfnoJTs78uQ0UnM0-hYPQ,cacio e pepe hidden gem tucked away hillview district serving authentic italian cuisine using quality ingredients many times,522,italian,1.35779616390878,103.760363020143,"['3 Chu Lin Road', 'Singapore 669890', 'Singapore']",3.5,3,$$$
6248,1392.0,1392.0,Cacio e Pepe Cucina Italiano,1qfnoJTs78uQ0UnM0-hYPQ,food generally okay service great small cozy hidden crowd restaurant sister like tiramisu found order,522,italian,1.35779616390878,103.760363020143,"['3 Chu Lin Road', 'Singapore 669890', 'Singapore']",3.5,3,$$$
6249,1396.0,1396.0,Senso Ristorante & Bar,XSw22_2mEntgX8I4tXBEhQ,really nice location central heart hip club street set conservation shophouse front houses bar,523,italian,1.28251,103.84663,"['21 Club St', 'Singapore 069410', 'Singapore']",4.0,14,$$$
6250,1397.0,1397.0,Senso Ristorante & Bar,XSw22_2mEntgX8I4tXBEhQ,taken saturday night didnt sit openair courtyard instead aced interior tastefully decorated,523,italian,1.28251,103.84663,"['21 Club St', 'Singapore 069410', 'Singapore']",4.0,14,$$$
6251,1398.0,1398.0,Senso Ristorante & Bar,XSw22_2mEntgX8I4tXBEhQ,upscale italian place club street food consistently good across board spectacular specific details based order bread,523,italian,1.28251,103.84663,"['21 Club St', 'Singapore 069410', 'Singapore']",4.0,14,$$$
6252,1387.0,1387.0,La Forketta Gastronomia Italiana,_S-6-jnrwbaAHAtmfjBGYQ,national day long weekend wanted bring kids keeping mind places timings visits would less,524,italian,1.3036447,103.8098267,"['9 Dempsey Rd', '#01-09', 'Singapore 247697', 'Singapore']",2.5,14,$$$
6253,1388.0,1388.0,La Forketta Gastronomia Italiana,_S-6-jnrwbaAHAtmfjBGYQ,thought tables around us full pretentious diners barking demanding silly really orders staffbut learned service,524,italian,1.3036447,103.8098267,"['9 Dempsey Rd', '#01-09', 'Singapore 247697', 'Singapore']",2.5,14,$$$
6254,1389.0,1389.0,La Forketta Gastronomia Italiana,_S-6-jnrwbaAHAtmfjBGYQ,going la forketta since humble beginnings years ago river valley rd consistent thing place throughout,524,italian,1.3036447,103.8098267,"['9 Dempsey Rd', '#01-09', 'Singapore 247697', 'Singapore']",2.5,14,$$$
6255,1393.0,1393.0,Motorino,Wg2_jFRb9AytqOMV4IEw1A,stopped singapore sling must tourist drink singapore went raffles hotel first drink originated smaller,525,italian,1.290286,103.845103,"['3A River Valley Rd', '#01-01A, Clarke Quay', 'Singapore 179020', 'Singapore']",3.5,15,$$$
6256,1394.0,1394.0,Motorino,Wg2_jFRb9AytqOMV4IEw1A,good pizza really good music atmosphere inside outside seating available limited menu pizza variety options,525,italian,1.290286,103.845103,"['3A River Valley Rd', '#01-01A, Clarke Quay', 'Singapore 179020', 'Singapore']",3.5,15,$$$
6257,1395.0,1395.0,Motorino,Wg2_jFRb9AytqOMV4IEw1A,great pizzasome toppings like would ever put meatballs pizza american wife see brick oven,525,italian,1.290286,103.845103,"['3A River Valley Rd', '#01-01A, Clarke Quay', 'Singapore 179020', 'Singapore']",3.5,15,$$$
6258,1399.0,1399.0,Mad For Garlic,vAp4d3J0wEWXsU8kmIaTTQ,occasions favourite dish order always snowy garlic pizza perfect garlic lovers thin crust pizza,526,italian,1.29359004484136,103.856668902169,"['No 3 Temasek Boulevard', '#02-300/301', 'Singapore 038983', 'Singapore']",2.5,12,$$$
6259,1400.0,1400.0,Mad For Garlic,vAp4d3J0wEWXsU8kmIaTTQ,came friends monday night upon recommendation place busy ordered combo b since popular garlic pane basically,526,italian,1.29359004484136,103.856668902169,"['No 3 Temasek Boulevard', '#02-300/301', 'Singapore 038983', 'Singapore']",2.5,12,$$$
6260,1401.0,1401.0,Mad For Garlic,vAp4d3J0wEWXsU8kmIaTTQ,bbq chicken ranch pizza starsgot without ranch dressing ranch dressing bad enough salads ordered,526,italian,1.29359004484136,103.856668902169,"['No 3 Temasek Boulevard', '#02-300/301', 'Singapore 038983', 'Singapore']",2.5,12,$$$
6261,1414.0,1414.0,Al Forno,BFT_7kFOCq8FjoINnxycLQ,al forno definitely fan base respect stopped public holiday restaurant packed without reservation,527,italian,1.30871,103.9120178,"['400 East Coast Rd', 'Singapore 428996', 'Singapore']",3.5,17,$$$
6262,1415.0,1415.0,Al Forno,BFT_7kFOCq8FjoINnxycLQ,everytime pass resto always full finally tonight got parking spot nearby went early tagliatelle tomato lobster,527,italian,1.30871,103.9120178,"['400 East Coast Rd', 'Singapore 428996', 'Singapore']",3.5,17,$$$
6263,1416.0,1416.0,Al Forno,BFT_7kFOCq8FjoINnxycLQ,quiet fan al fornos years already seriously im old remember fondest dates,527,italian,1.30871,103.9120178,"['400 East Coast Rd', 'Singapore 428996', 'Singapore']",3.5,17,$$$
6264,1402.0,1402.0,Truffle Gourmet,wo1QAq8_nNsYKtfnwf1OUg,must reason even offer free drinks wednesdays restaurant half emptyyes white truffle affordable serve,528,italian,1.2821362,103.8459818,"['49 Club Street', 'Singapore 069426', 'Singapore']",3.0,3,$$$
6265,1403.0,1403.0,Truffle Gourmet,wo1QAq8_nNsYKtfnwf1OUg,truffles simplest ingredient make anything taste good like foods unfair advantage dishes like athletes using,528,italian,1.2821362,103.8459818,"['49 Club Street', 'Singapore 069426', 'Singapore']",3.0,3,$$$
6266,1404.0,1404.0,Truffle Gourmet,wo1QAq8_nNsYKtfnwf1OUg,truffle gourmet beautiful space good ambiance friendly attentive service regular menu consisting smaller bites,528,italian,1.2821362,103.8459818,"['49 Club Street', 'Singapore 069426', 'Singapore']",3.0,3,$$$
6273,1411.0,1411.0,Trattoria L'Operetta,NMz0wMYMTnsyC_sulMLwlA,brunos busy trattoria loperetta great alternativeyou get pizzas pastas wood fire oven expect great,530,italian,1.30641,103.89559,"['244 Tanjong Katong Road', 'Singapore 437032', 'Singapore']",3.5,9,$$$
6274,1412.0,1412.0,Trattoria L'Operetta,NMz0wMYMTnsyC_sulMLwlA,ordered two pizzas today deliveroo quite disappointed tomato sauce pinkish bland crust thinner last time,530,italian,1.30641,103.89559,"['244 Tanjong Katong Road', 'Singapore 437032', 'Singapore']",3.5,9,$$$
6275,1413.0,1413.0,Trattoria L'Operetta,NMz0wMYMTnsyC_sulMLwlA,lovely spot east great ambiance lot thought went making feel like authentic italian eatery foods legit came,530,italian,1.30641,103.89559,"['244 Tanjong Katong Road', 'Singapore 437032', 'Singapore']",3.5,9,$$$
6276,1417.0,1417.0,Palio,EwCzIUK13aETTEctLm6QHg,first time trying restaurant palio resort world sentosa tuscan cuisine restaurant also part hotel michael sentosa,531,italian,1.25542786164439,103.819882850406,"['Hotel Michael Sentosa', 'Level 2', 'Singapore', 'Singapore']",3.5,2,$$$
6277,1418.0,1418.0,Palio,EwCzIUK13aETTEctLm6QHg,kids friendly spacious good dining option around resorts world family grand value meal includes soft drink soup pasta pizza icecream,531,italian,1.25542786164439,103.819882850406,"['Hotel Michael Sentosa', 'Level 2', 'Singapore', 'Singapore']",3.5,2,$$$
6278,1422.0,1422.0,Sopra Cucina & Bar,RImr8phEXduxRi6y_7pf7w,italian diners sardinia agreed meal super bravo team star mealporcheddu sardotraditional sardinian style,532,italian,1.3076066,103.8301208,"['10 Claymore Road', '#01-02, Pan Pacific Orchard Hotel', 'Singapore 229540', 'Singapore']",3.5,7,$$$
6279,1423.0,1423.0,Sopra Cucina & Bar,RImr8phEXduxRi6y_7pf7w,nice italien restaurant atmosphere really good interior kept dark heavy look long time since italian,532,italian,1.3076066,103.8301208,"['10 Claymore Road', '#01-02, Pan Pacific Orchard Hotel', 'Singapore 229540', 'Singapore']",3.5,7,$$$
6280,1424.0,1424.0,Sopra Cucina & Bar,RImr8phEXduxRi6y_7pf7w,nice italian restaurant somewhat unexpected location ambiance nicei requested quiet table lovely spot back,532,italian,1.3076066,103.8301208,"['10 Claymore Road', '#01-02, Pan Pacific Orchard Hotel', 'Singapore 229540', 'Singapore']",3.5,7,$$$
6281,1425.0,1425.0,Burlamacco Ristorante,4wqbBAk44a5Yb4dFb6XwKw,find chunks garlic risotto milanese known im far away possible authentic italian food bad starters,533,italian,1.2804805,103.8468004,"['77 Amoy Street', 'Singapore 069896', 'Singapore']",3.5,6,$$$
6282,1426.0,1426.0,Burlamacco Ristorante,4wqbBAk44a5Yb4dFb6XwKw,picked unique little spot date night last week disappoint went set meal dinner wine pairings everything,533,italian,1.2804805,103.8468004,"['77 Amoy Street', 'Singapore 069896', 'Singapore']",3.5,6,$$$
6283,1427.0,1427.0,Burlamacco Ristorante,4wqbBAk44a5Yb4dFb6XwKw,went lunch weekday place packed office folks good sign service warm efficientthe food,533,italian,1.2804805,103.8468004,"['77 Amoy Street', 'Singapore 069896', 'Singapore']",3.5,6,$$$
6284,1419.0,1419.0,Trattoria Italian Kitchen,H7jKI9DqgcnKh0Zmfd0qyA,one favorite spots singaporeconveniently right outside mrt one best pizzas singapore especially cheese pizza,534,italian,1.30106,103.8384705,"['313 Orchard Road', '313 Somerset', 'Singapore 238895', 'Singapore']",3.0,5,$$$
6285,1420.0,1420.0,Trattoria Italian Kitchen,H7jKI9DqgcnKh0Zmfd0qyA,close hotel walk happy hour buy otus strong special taste isbgoo,534,italian,1.30106,103.8384705,"['313 Orchard Road', '313 Somerset', 'Singapore 238895', 'Singapore']",3.0,5,$$$
6286,1421.0,1421.0,Trattoria Italian Kitchen,H7jKI9DqgcnKh0Zmfd0qyA,pizza appeared properly baked inexplicably served wooden platform trapped moisture came soft soggy,534,italian,1.30106,103.8384705,"['313 Orchard Road', '313 Somerset', 'Singapore 238895', 'Singapore']",3.0,5,$$$
6287,1428.0,1428.0,Pietro Ristorante Italiano,-fFw_OsrOiLFiWhaTtwwrw,tried place due leslie tays blog went saturday delighted find theres live singing going ordered squid ink pasta,535,italian,1.38328676960123,103.876074733174,"['12 Jalan Kelulut', 'Singapore 809030', 'Singapore']",3.0,5,$$$
6288,1429.0,1429.0,Pietro Ristorante Italiano,-fFw_OsrOiLFiWhaTtwwrw,mexican bday meals hub happy eat next favourite cuisine pizza decided pietro north anyway hungry,535,italian,1.38328676960123,103.876074733174,"['12 Jalan Kelulut', 'Singapore 809030', 'Singapore']",3.0,5,$$$
6289,1430.0,1430.0,Pietro Ristorante Italiano,-fFw_OsrOiLFiWhaTtwwrw,theres lot nice restaurants section town think restaurant relies nice dishes menu,535,italian,1.38328676960123,103.876074733174,"['12 Jalan Kelulut', 'Singapore 809030', 'Singapore']",3.0,5,$$$
6296,1431.0,1431.0,Ristorante da Valentino,kreVrwY9zqfQVFbF-CP_Gg,ive ever old location rifle range new set much bigger yet theyve somehow manage keep ambience cosy service,537,italian,1.336877,103.793967,"['200 Turf Club Road', '#01-19', 'Singapore 287994', 'Singapore']",3.5,19,$$$
6297,1432.0,1432.0,Ristorante da Valentino,kreVrwY9zqfQVFbF-CP_Gg,found italian place one best italian singapore however meet mr valentino order menu,537,italian,1.336877,103.793967,"['200 Turf Club Road', '#01-19', 'Singapore 287994', 'Singapore']",3.5,19,$$$
6298,1433.0,1433.0,Ristorante da Valentino,kreVrwY9zqfQVFbF-CP_Gg,cant recall last time business arrogant offensive especially serving fake wines group nine began,537,italian,1.336877,103.793967,"['200 Turf Club Road', '#01-19', 'Singapore 287994', 'Singapore']",3.5,19,$$$
6299,1437.0,1437.0,Sole Pomodoro,Ly379pe5SkCK0PFh7CN7VA,pizza place sentosa staycation nearby stopped dinner pizza average ambience good located,538,italian,1.2467652779303,103.841941846458,"['31 Ocean Way', '#01-14 Quayside Isle  Sentosa Cove', 'Bedok 098375', 'Singapore']",2.5,7,$$$
6300,1438.0,1438.0,Sole Pomodoro,Ly379pe5SkCK0PFh7CN7VA,place pretty good ordered melanzane alla parmiggiana baked eggplant delicious perfect amount two people,538,italian,1.2467652779303,103.841941846458,"['31 Ocean Way', '#01-14 Quayside Isle  Sentosa Cove', 'Bedok 098375', 'Singapore']",2.5,7,$$$
6301,1439.0,1439.0,Sole Pomodoro,Ly379pe5SkCK0PFh7CN7VA,service really badwe ordered caprese salad ok margarita pizza came hot nothing rave basket bread,538,italian,1.2467652779303,103.841941846458,"['31 Ocean Way', '#01-14 Quayside Isle  Sentosa Cove', 'Bedok 098375', 'Singapore']",2.5,7,$$$
6308,1443.0,1443.0,Pepenero,E3nOVf6vvIRpS-7eUvDb4Q,pleasant evening spent staff polite unobtrusive ambience cozy yet scary loud groupthe food,540,italian,1.28036,103.8480835,"['14 Stanley Street', 'Singapore 068733', 'Singapore']",3.5,7,$$$
6309,1444.0,1444.0,Pepenero,E3nOVf6vvIRpS-7eUvDb4Q,awesome awesome service team wonderful friendly thoughtful liked wine recommendations lot menu isnt regular,540,italian,1.28036,103.8480835,"['14 Stanley Street', 'Singapore 068733', 'Singapore']",3.5,7,$$$
