,Unnamed: 0_x,Unnamed: 0.1,name,id,review,Unnamed: 0_y,cuisine,latitude,longitude,address,rating,review_count,price
11587,2455.0,2455.0,Jang Won Korean,pR4EpiuHr_yOXbjmyPuM_Q,tanjong pagar know affectionately little korea influx korean restaurants shops opening stone throw away along mosque,907,korean,1.28399,103.84469,"['44 Mosque St', 'Singapore 059522', 'Singapore']",4.0,4,$$
11588,2456.0,2456.0,Jang Won Korean,pR4EpiuHr_yOXbjmyPuM_Q,recommend yelps eager try restaurant overall food ok pancake portion small compare korean restaurants,907,korean,1.28399,103.84469,"['44 Mosque St', 'Singapore 059522', 'Singapore']",4.0,4,$$
11589,2451.0,2451.0,Chang Korean Charcoal BBQ,Ur4Ix4MK7YFKDKgR8FIxjg,cold noodles amazing rib bone lucky soul otherwise love pork jowl beef short ribs,908,korean,1.30592,103.810463,"['18 Dempsey Rd', 'Singapore 249677', 'Singapore']",3.5,9,$$
11590,2452.0,2452.0,Chang Korean Charcoal BBQ,Ur4Ix4MK7YFKDKgR8FIxjg,good spot korean bbq good variety highquality beef marinated nonmarinated options excellent also nongrill,908,korean,1.30592,103.810463,"['18 Dempsey Rd', 'Singapore 249677', 'Singapore']",3.5,9,$$
11591,2453.0,2453.0,Chang Korean Charcoal BBQ,Ur4Ix4MK7YFKDKgR8FIxjg,place average nothing really stood compel come back meat well seasoned tasted good,908,korean,1.30592,103.810463,"['18 Dempsey Rd', 'Singapore 249677', 'Singapore']",3.5,9,$$
11592,2457.0,2457.0,Goki Day Korean BBQ Buffet Restaurant,lVMY9r2pIW16cHgmLc6V-Q,kbbqaycewho wouldnt pack febreeze bring extra shirt stack wet wipes carnivorousyoloappetiteand youll,909,korean,1.3532709,103.8767809,"['19 Teck Chye Terrace', 'Singapore 545725', 'Singapore']",4.5,2,$$
11593,2458.0,2458.0,Goki Day Korean BBQ Buffet Restaurant,lVMY9r2pIW16cHgmLc6V-Q,korean colleague always come place boss waiters koreans really enjoy bbq friends,909,korean,1.3532709,103.8767809,"['19 Teck Chye Terrace', 'Singapore 545725', 'Singapore']",4.5,2,$$
11594,2462.0,2462.0,Woori-Nara Korean Restaurant,T0ctrA54l4xsMHkLe_fXZQ,bulgogi starscompared togi kims doors bulgogi least amount meat fattiest thickest meat,910,korean,1.34096,103.7736206,"['19 Lorong Kilat', '#01-02', 'Singapore 598120', 'Singapore']",2.0,5,$$
11595,2463.0,2463.0,Woori-Nara Korean Restaurant,T0ctrA54l4xsMHkLe_fXZQ,woorinara famous korean fried chicken eat ive never really felt need order much else,910,korean,1.34096,103.7736206,"['19 Lorong Kilat', '#01-02', 'Singapore 598120', 'Singapore']",2.0,5,$$
11596,2464.0,2464.0,Woori-Nara Korean Restaurant,T0ctrA54l4xsMHkLe_fXZQ,friends came dinner friday night side dishes alright seafood kimchi pancake delicious also ordered army,910,korean,1.34096,103.7736206,"['19 Lorong Kilat', '#01-02', 'Singapore 598120', 'Singapore']",2.0,5,$$
11597,2459.0,2459.0,Hanwoori Korean Restaurant,5ET7CDXydxP7nyk9Uv1-Fw,authentic korean food tucked quiet corner serangoon gardens excited heard free flow side dishes banchanoh miss,911,korean,1.36427,103.8651581,"['76 Serangoon Garden Way', 'Singapore 555972', 'Singapore']",3.0,7,$$
11598,2460.0,2460.0,Hanwoori Korean Restaurant,5ET7CDXydxP7nyk9Uv1-Fw,coming many times food really good frills great home cooked tasteone better jjim dak tasted,911,korean,1.36427,103.8651581,"['76 Serangoon Garden Way', 'Singapore 555972', 'Singapore']",3.0,7,$$
11599,2461.0,2461.0,Hanwoori Korean Restaurant,5ET7CDXydxP7nyk9Uv1-Fw,authentic korean restaurant tucked away quiet corner serangoon gardens shop adjacent ocbc bank dessert bowl opened fairly,911,korean,1.36427,103.8651581,"['76 Serangoon Garden Way', 'Singapore 555972', 'Singapore']",3.0,7,$$
11624,2465.0,2465.0,Masizzim Singapore,llD-0OeIBcXpbsK-OhQ1Aw,pork stew individual portion starsspiciness level glass noodlestoo little meat much fat bone werent many,913,korean,1.30089,103.83843,"['313 Orchard Rd', '#B3-02', 'Singapore 238895', 'Singapore']",3.5,8,$$
11625,2466.0,2466.0,Masizzim Singapore,llD-0OeIBcXpbsK-OhQ1Aw,recently another new korean restaurant opened shopping mall known stew available pork beef chicken remember,913,korean,1.30089,103.83843,"['313 Orchard Rd', '#B3-02', 'Singapore 238895', 'Singapore']",3.5,8,$$
11626,2467.0,2467.0,Masizzim Singapore,llD-0OeIBcXpbsK-OhQ1Aw,craving korean always appreciate good stew place pork ribs got kimchi fried rice liked kimchi fried rice however thought,913,korean,1.30089,103.83843,"['313 Orchard Rd', '#B3-02', 'Singapore 238895', 'Singapore']",3.5,8,$$
11627,2471.0,2471.0,Arirang Korean Restaurant,iIh8lzqoUtVzELnV6VhVsg,food service remains management might need pay attention maintenance place see proper maintenance,914,korean,1.29772,103.8565292,"['1 Liang Seah Street', '#01-07/08 Liang Seah Place', 'Singapore 189022', 'Singapore']",3.5,3,$$
11628,2472.0,2472.0,Arirang Korean Restaurant,iIh8lzqoUtVzELnV6VhVsg,arirang korean restaurant famous korean bbq order either la carte buffet style meats seafood menu also,914,korean,1.29772,103.8565292,"['1 Liang Seah Street', '#01-07/08 Liang Seah Place', 'Singapore 189022', 'Singapore']",3.5,3,$$
11629,2473.0,2473.0,Arirang Korean Restaurant,iIh8lzqoUtVzELnV6VhVsg,korean bbq restaurants becoming increasingly popular singapore arirang korean restaurant extensive menu wide variety ala,914,korean,1.29772,103.8565292,"['1 Liang Seah Street', '#01-07/08 Liang Seah Place', 'Singapore 189022', 'Singapore']",3.5,3,$$
11634,2475.0,2475.0,Manna Story,a_hLJHt1caE2TKIMNrGLNw,decided eat movie queue restaurants queues dinner time iced water servedsaba,916,korean,1.30048,103.8449097,"['68 Orchard Road, #B2-22', 'Plaza Singapura', 'Singapore 238839', 'Singapore']",2.5,8,$$
11635,2476.0,2476.0,Manna Story,a_hLJHt1caE2TKIMNrGLNw,korean food cravings lately decided drop saturday seeing storefront days interior design,916,korean,1.30048,103.8449097,"['68 Orchard Road, #B2-22', 'Plaza Singapura', 'Singapore 238839', 'Singapore']",2.5,8,$$
11636,2477.0,2477.0,Manna Story,a_hLJHt1caE2TKIMNrGLNw,believe decent korean restaurant plaza singapura ive somewhere would go,916,korean,1.30048,103.8449097,"['68 Orchard Road, #B2-22', 'Plaza Singapura', 'Singapore 238839', 'Singapore']",2.5,8,$$
11637,2481.0,2481.0,Bornga,Shhy8-qHgIUPNpNh50YAow,usamgyup enjoyable familiar thinly sliced marinated beef typical beef bbq great yje impressive,917,korean,1.29532,103.8593826,"['Suntec City', 'Tower 3, #01-641/642', 'Singapore 038988', 'Singapore']",3.5,4,$$
11638,2482.0,2482.0,Bornga,Shhy8-qHgIUPNpNh50YAow,beef thinly sliced taste anything quite enjoy pork belly side dishes ok lacking core dish ikan bilis,917,korean,1.29532,103.8593826,"['Suntec City', 'Tower 3, #01-641/642', 'Singapore 038988', 'Singapore']",3.5,4,$$
11639,2483.0,2483.0,Bornga,Shhy8-qHgIUPNpNh50YAow,review best part friday last week way hell oh god hell singapore overrated overpriced overhyped,917,korean,1.29532,103.8593826,"['Suntec City', 'Tower 3, #01-641/642', 'Singapore 038988', 'Singapore']",3.5,4,$$
11640,2518.0,2518.0,Bornga,EOEUrh9zaD2hRW4uoowsYQ,expensive side really tasty use real charcoal get much better flavor gas grill cook meat,917,korean,1.29532,103.8593826,"['Suntec City', 'Tower 3, #01-641/642', 'Singapore 038988', 'Singapore']",3.5,4,$$
11641,2519.0,2519.0,Bornga,EOEUrh9zaD2hRW4uoowsYQ,stars army stew beef broth love beef friends cant eat beef religious purpose,917,korean,1.29532,103.8593826,"['Suntec City', 'Tower 3, #01-641/642', 'Singapore 038988', 'Singapore']",3.5,4,$$
11642,2520.0,2520.0,Bornga,EOEUrh9zaD2hRW4uoowsYQ,stopped tuesday lunch family pretty quiet inside noon believe seated immediately ordered woo,917,korean,1.29532,103.8593826,"['Suntec City', 'Tower 3, #01-641/642', 'Singapore 038988', 'Singapore']",3.5,4,$$
11643,2478.0,2478.0,Koryo Restaurant,kUgJnd-GMLyNZrF54uSSrA,one reasons colleagues say theres nothing eat fusionopolis twice first time said never,918,korean,1.2983902,103.7880783,"['1 Fusionopolis Way #02-10 Fusionopolis, Connexis Tower', 'Singapore 138632', 'Singapore']",3.0,6,$$
11644,2479.0,2479.0,Koryo Restaurant,kUgJnd-GMLyNZrF54uSSrA,place gem introduced place professor lunch date team really full lunchthey serve,918,korean,1.2983902,103.7880783,"['1 Fusionopolis Way #02-10 Fusionopolis, Connexis Tower', 'Singapore 138632', 'Singapore']",3.0,6,$$
11645,2480.0,2480.0,Koryo Restaurant,kUgJnd-GMLyNZrF54uSSrA,places always crowded rains lunch time seems like many others following colleagues pop hot soothing,918,korean,1.2983902,103.7880783,"['1 Fusionopolis Way #02-10 Fusionopolis, Connexis Tower', 'Singapore 138632', 'Singapore']",3.0,6,$$
11646,2484.0,2484.0,Bibigo,mK8Ic0y8QR3MIujYeDjFIA,food decent service ok bad food doesnt come side items im use korean restaurants side dishes,919,korean,1.29558,103.8589401,"['9 Temasek Boulevard', '#B1-107, Suntec Tower 2', 'Singapore 038989', 'Singapore']",2.5,3,$$
11647,2485.0,2485.0,Bibigo,mK8Ic0y8QR3MIujYeDjFIA,first time bibigo ordered spicy soft tofu soup pork tasted ok wow normal decent korean soup expecting since,919,korean,1.29558,103.8589401,"['9 Temasek Boulevard', '#B1-107, Suntec Tower 2', 'Singapore 038989', 'Singapore']",2.5,3,$$
11648,2486.0,2486.0,Bibigo,mK8Ic0y8QR3MIujYeDjFIA,food portions small price piece cut beef bulgogi also clams tofu soup fresh clams,919,korean,1.29558,103.8589401,"['9 Temasek Boulevard', '#B1-107, Suntec Tower 2', 'Singapore 038989', 'Singapore']",2.5,3,$$
11649,2487.0,2487.0,ChoWon,eC18mYl5HrF_Ezd5t0BGCQ,two korean restaurants along peck seah street chowon one chowon used two options seating tatami tableschairs,920,korean,1.2789179,103.8450012,"['2 Peck Seah St', 'Singapore 079305', 'Singapore']",3.5,2,$$
11650,2488.0,2488.0,ChoWon,eC18mYl5HrF_Ezd5t0BGCQ,place good option looking authentic korean food pretty extensive menu six dishes group ordered,920,korean,1.2789179,103.8450012,"['2 Peck Seah St', 'Singapore 079305', 'Singapore']",3.5,2,$$
11651,2489.0,2489.0,Seoul Garden,QOit-HgMOo01iXmTOXc-wA,vegan like know im eating avoid anything animal based buffets afford opportunity cook,921,korean,1.29966,103.85571,"['200 Victoria St', '#02-52, Bugis Junction', 'Singapore 188021', 'Singapore']",3.0,1,$$
11652,2491.0,2491.0,Nolboo Hangari Galbi,ONau0yk_Pat3qsF3En1Sjg,one favorite korean restos spore food quality good consistent try kimchi pork belly dish yummy,922,korean,1.30111,103.8394699,"['181 Orch Rd', '#08-04/05', 'Singapore 238896', 'Singapore']",4.0,1,$$
11653,2492.0,2492.0,His.tori BBQ,Zr-T2cSiHEEkq6ixipRS5g,wife craving korean bbq sunday evening decided go area plenty korean restaurants tanjong pagar hopped,923,korean,1.27882,103.8454208,"['20 Tanjong Pagar Road', 'Singapore 088443', 'Singapore']",3.5,3,$$
11654,2493.0,2493.0,His.tori BBQ,Zr-T2cSiHEEkq6ixipRS5g,ive walked place many times always wondered aboutit looks like korean bbq smells like korean bbq never see,923,korean,1.27882,103.8454208,"['20 Tanjong Pagar Road', 'Singapore 088443', 'Singapore']",3.5,3,$$
11655,2494.0,2494.0,His.tori BBQ,Zr-T2cSiHEEkq6ixipRS5g,wed looking place get great korean bbq singapore found strip places next decided walk,923,korean,1.27882,103.8454208,"['20 Tanjong Pagar Road', 'Singapore 088443', 'Singapore']",3.5,3,$$
11656,2498.0,2498.0,Ssikkek Korean Grill Bbq Buffet,rdzE_UW5_iX1ihgowkAVlg,ahh korean bbq buffetsthis review based dinner sep ssikkek goto places quick fast korean bbq fix,924,korean,1.29653,103.8537064,"['231 Bain Street', '#02-01 Bras Basah Complex', 'Singapore 180231', 'Singapore']",3.0,6,$$
11657,2499.0,2499.0,Ssikkek Korean Grill Bbq Buffet,rdzE_UW5_iX1ihgowkAVlg,heard ssikkek korean grill bbq outlets one bras basah least known thus always head sure youll,924,korean,1.29653,103.8537064,"['231 Bain Street', '#02-01 Bras Basah Complex', 'Singapore 180231', 'Singapore']",3.0,6,$$
11658,2500.0,2500.0,Ssikkek Korean Grill Bbq Buffet,rdzE_UW5_iX1ihgowkAVlg,saw customers getting steamboat asked could well waiter said steamboat koreans like er,924,korean,1.29653,103.8537064,"['231 Bain Street', '#02-01 Bras Basah Complex', 'Singapore 180231', 'Singapore']",3.0,6,$$
11659,2495.0,2495.0,Blue Garden Korean BBQ Buffet Restaurant,MxglDsB3ImUIIMKmFumbBg,came try right work friday probably arrived right opened pork beef chicken prawns squid mushrooms enoki,925,korean,1.28478,103.8343735,"['50 Tiong Bahru Road #01-07 Link Hotel', 'Singapore 168733', 'Singapore']",3.0,4,$$
11660,2496.0,2496.0,Blue Garden Korean BBQ Buffet Restaurant,MxglDsB3ImUIIMKmFumbBg,saranghaeyo official love letter amazing meat blue garden korean bbq buffet restaurantit began got cab tiong,925,korean,1.28478,103.8343735,"['50 Tiong Bahru Road #01-07 Link Hotel', 'Singapore 168733', 'Singapore']",3.0,4,$$
11661,2497.0,2497.0,Blue Garden Korean BBQ Buffet Restaurant,MxglDsB3ImUIIMKmFumbBg,alternative korean restaurant area fully booked saturday evening mama mia running late,925,korean,1.28478,103.8343735,"['50 Tiong Bahru Road #01-07 Link Hotel', 'Singapore 168733', 'Singapore']",3.0,4,$$
11662,2501.0,2501.0,Andong Zzimdak,zHaUOTpzhAkLRu1XDmV9eA,andong jjimdak one absolute fave dishes korea ate wellknown chain bongchu jjimdak ive craving since seems like korean,926,korean,1.29310760716505,103.85307470394,"['252 North Bridge Rd', '#B1-44F', 'Singapore 179103', 'Singapore']",3.0,1,$$
11663,2502.0,2502.0,Bingki Korean Dessert,kpYp84QBIOEW-GIE7d842A,cafe recently changed operating hours longer operate hours new operating hours follows monthurs frisun,927,korean,1.27702743382228,103.843015190343,"['7 Tanjong Pagar Plaza', '#01-106', 'Singapore 081007', 'Singapore']",3.5,2,$$
11664,2503.0,2503.0,Bingki Korean Dessert,kpYp84QBIOEW-GIE7d842A,whats love thinly shaved ice favorite toppings sunny singapore bingki serves selection bingsu korean shaved,927,korean,1.27702743382228,103.843015190343,"['7 Tanjong Pagar Plaza', '#01-106', 'Singapore 081007', 'Singapore']",3.5,2,$$
11774,2515.0,2515.0,Ju Shin Jung,hSpwbWTZJaCLsGsbjoiPWQ,old haunt ive missing still good although longer packed feels like time stood still nothing much,933,korean,1.283221,103.780681,"['27 West Coast Highway', '#01-18/19', 'Singapore 117867', 'Singapore']",4.0,5,$$$
11775,2516.0,2516.0,Ju Shin Jung,hSpwbWTZJaCLsGsbjoiPWQ,good food great service waiters helpful prompt attending requests kudos team better plan restaurant,933,korean,1.283221,103.780681,"['27 West Coast Highway', '#01-18/19', 'Singapore 117867', 'Singapore']",4.0,5,$$$
11776,2517.0,2517.0,Ju Shin Jung,hSpwbWTZJaCLsGsbjoiPWQ,great food amount much couple place family meat eaters store vacuum equipment open,933,korean,1.283221,103.780681,"['27 West Coast Highway', '#01-18/19', 'Singapore 117867', 'Singapore']",4.0,5,$$$
11783,2521.0,2521.0,Crystal Jade Ginseng Chicken & BBQ,ySW4E4GIN7SSa4U8yA2f_Q,always associated crystal jade chinese food well serve korean food well name misleading assumed served sort,935,korean,1.30261187919852,103.83534707129,"['391 Orchard Road', '#04-20 Ngee Ann City', 'Singapore 238872', 'Singapore']",3.5,2,$$$
11784,2522.0,2522.0,Crystal Jade Ginseng Chicken & BBQ,ySW4E4GIN7SSa4U8yA2f_Q,anything crystal jade group attempting toquite ingenious move focus entire restaurant around ginseng,935,korean,1.30261187919852,103.83534707129,"['391 Orchard Road', '#04-20 Ngee Ann City', 'Singapore 238872', 'Singapore']",3.5,2,$$$
11785,2523.0,2523.0,Todamgol,wxf-tyEbFaatpJL-43JJpQ,craving bibimbap chance upon placecame church buddies decided go tteokbokki even though wanted try,936,korean,1.27661,103.84406,"['31 Tanjong Paga Rd', '#01-01', 'Singapore 088454', 'Singapore']",4.0,10,$$$
11786,2524.0,2524.0,Todamgol,wxf-tyEbFaatpJL-43JJpQ,thought food ok probably worth price tag go dinner lunch specials side dishes meh bit,936,korean,1.27661,103.84406,"['31 Tanjong Paga Rd', '#01-01', 'Singapore 088454', 'Singapore']",4.0,10,$$$
11787,2525.0,2525.0,Todamgol,wxf-tyEbFaatpJL-43JJpQ,disclaimerbeing korean dude although us selective korean food since prefer authentic korean food,936,korean,1.27661,103.84406,"['31 Tanjong Paga Rd', '#01-01', 'Singapore 088454', 'Singapore']",4.0,10,$$$
11788,2526.0,2526.0,Kim's Family Food Korean Restaurant,jrri7I3ZscmfRLEeIc0UXg,beef bulgogi glass noodle stew starsway sweet need halve sugartteokbokki starsnot spicy flavor pretty,937,korean,1.34085033489615,103.77419628982,"['17 Lor Kilat', 'Singapore 598139', 'Singapore']",3.5,15,$$$
11789,2527.0,2527.0,Kim's Family Food Korean Restaurant,jrri7I3ZscmfRLEeIc0UXg,friends went around friday seated immediately arriving got supplementary knock yakult drink,937,korean,1.34085033489615,103.77419628982,"['17 Lor Kilat', 'Singapore 598139', 'Singapore']",3.5,15,$$$
11790,2528.0,2528.0,Kim's Family Food Korean Restaurant,jrri7I3ZscmfRLEeIc0UXg,dont come peak hours waiting place even weve called reserve seat need queue,937,korean,1.34085033489615,103.77419628982,"['17 Lor Kilat', 'Singapore 598139', 'Singapore']",3.5,15,$$$
11791,2529.0,2529.0,Superstar K,igm0N-jTJ_SkMl_zE6pDnw,came saturday night korean barbecue fix left tummies filled happywe got pork belly seasoned beef ribs sets,938,korean,1.27882,103.8454208,"['75 Tanjong Pagar Road', 'Singapore 088496', 'Singapore']",4.5,14,$$$
11792,2530.0,2530.0,Superstar K,igm0N-jTJ_SkMl_zE6pDnw,maybe delicious bottle soju talking superstar k new favorite korean bbq tanjong pagar begin theres,938,korean,1.27882,103.8454208,"['75 Tanjong Pagar Road', 'Singapore 088496', 'Singapore']",4.5,14,$$$
11793,2531.0,2531.0,Superstar K,igm0N-jTJ_SkMl_zE6pDnw,straightforward superstar k generous side dishes napkins also serve softest pork belly tastiest kimchi jjigae ive,938,korean,1.27882,103.8454208,"['75 Tanjong Pagar Road', 'Singapore 088496', 'Singapore']",4.5,14,$$$
11794,2545.0,2545.0,Superstar K,WTbJIOHlqJMu-j20qLUa8g,bunch us craving korean food decided check superstar k upon recommendation korean friend korean says good,938,korean,1.27882,103.8454208,"['75 Tanjong Pagar Road', 'Singapore 088496', 'Singapore']",4.5,14,$$$
11795,2532.0,2532.0,Seorae Korean Charcoal BBQ - Plaza Singapura,KmlJE7tEjImGdPbA9fNaFQ,went friday let friend order ended getting beef pork sure exactly kind beef good im,939,korean,1.30048,103.84491,"['68 Orchard Rd', '#02-01', 'Singapore 238839', 'Singapore']",3.5,4,$$$
11796,2533.0,2533.0,Seorae Korean Charcoal BBQ - Plaza Singapura,KmlJE7tEjImGdPbA9fNaFQ,great food great staff drinks flowing husband great lunch date today lovely time back,939,korean,1.30048,103.84491,"['68 Orchard Rd', '#02-01', 'Singapore 238839', 'Singapore']",3.5,4,$$$
11797,2534.0,2534.0,Seorae Korean Charcoal BBQ - Plaza Singapura,KmlJE7tEjImGdPbA9fNaFQ,came dinner wednesday night girlfriends queue pretty long luckily made good judgement book advance got,939,korean,1.30048,103.84491,"['68 Orchard Rd', '#02-01', 'Singapore 238839', 'Singapore']",3.5,4,$$$
11798,2535.0,2535.0,Nanta BBQ,vjvGpupK2KiImsaX7xU0BQ,couple years ago korean friend introduced cheesy corn apparently korean dish little baffled assured melted,940,korean,1.31833,103.8437195,"['175 Thomson Road', 'Singapore 307624', 'Singapore']",4.0,1,$$$
11799,2536.0,2536.0,Obba BBQ,iq10ODcGnhq88WdSE6UOaA,wait place stars guess bad reviews years ago must completely different,941,korean,1.27818885029025,103.843960314989,"['63 Tanjong Pagar Road', 'Singapore 088484', 'Singapore']",3.0,12,$$$
11800,2537.0,2537.0,Obba BBQ,iq10ODcGnhq88WdSE6UOaA,always saw long lines walking past obbas three stores along tanjong pagar rd put togo list wait reasonable min,941,korean,1.27818885029025,103.843960314989,"['63 Tanjong Pagar Road', 'Singapore 088484', 'Singapore']",3.0,12,$$$
11801,2538.0,2538.0,Obba BBQ,iq10ODcGnhq88WdSE6UOaA,got takeaway packaged banchan us toosteamed egg flying fish roe starsgood tasted rich like add butter maybebulgogi,941,korean,1.27818885029025,103.843960314989,"['63 Tanjong Pagar Road', 'Singapore 088484', 'Singapore']",3.0,12,$$$
11802,2539.0,2539.0,Han Kook Gwan,wuggTlsUwvZzGs5xJfM6Hg,open early morning daily worries starving past midnight longer hanguk guan whether youre,942,korean,1.27976286982569,103.84380844709,"['26 Tanjong Pagar Road', 'Singapore 088449', 'Singapore']",4.0,1,$$$
11803,2540.0,2540.0,Yoogane,gy5uEidPhaH-_kBGdp-pjQ,army stew quite good although soup gets salty keep topping fresh stock quite good value money since,943,korean,1.3026201,103.8544006,"['4 Rochor Road', '#02-47/48, Bugis Junction', 'Singapore 181004', 'Singapore']",3.5,5,$$$
11804,2541.0,2541.0,Yoogane,gy5uEidPhaH-_kBGdp-pjQ,first time hearing friends another group friends though didnt try dakgalbi nonspicy army stew,943,korean,1.3026201,103.8544006,"['4 Rochor Road', '#02-47/48, Bugis Junction', 'Singapore 181004', 'Singapore']",3.5,5,$$$
11805,2542.0,2542.0,Yoogane,gy5uEidPhaH-_kBGdp-pjQ,yoogane girlfriend read review say star review decided give try upon arrival today queue,943,korean,1.3026201,103.8544006,"['4 Rochor Road', '#02-47/48, Bugis Junction', 'Singapore 181004', 'Singapore']",3.5,5,$$$
11806,2543.0,2543.0,Dal In Korean Restaurant,grHoClT8QA9BoVSX2j3pcQ,one popular lunch places among korean expats around raffles place restaurant famous bimbimbap generous side dish,944,korean,1.28136211763068,103.84832996875,"['17 Boon Tat St', 'Singapore 069618', 'Singapore']",3.5,2,$$$
11807,2544.0,2544.0,Dal In Korean Restaurant,grHoClT8QA9BoVSX2j3pcQ,theres ever cuisine makes feel like nopalate fool time korean mean love korean food im fortunate enough,944,korean,1.28136211763068,103.84832996875,"['17 Boon Tat St', 'Singapore 069618', 'Singapore']",3.5,2,$$$
11812,2546.0,2546.0,Sojap Neun Eubo,lunaNcbRetjDSlztP0dEiQ,everything pretty solid actually picked lot places closed yelp pretty bad non date info,946,korean,1.27851633353848,103.84386241436,"['58 Tanjong Pagar Rd', 'Singapore 088479', 'Singapore']",3.0,1,$$$
11813,2547.0,2547.0,Kko Kko Na Ra,r2L533c9lFGpjcuUJKY2PA,absolutely best place hang yummy chicken wings bo ssam tofu hot pot simply world flavors,947,korean,1.27886991616913,103.843822979319,"['68 Tanjong Pagar Rd', 'Singapore 088489', 'Singapore']",3.5,13,$$$
11814,2548.0,2548.0,Kko Kko Na Ra,r2L533c9lFGpjcuUJKY2PA,youre looking korean fried chicken dont want queue chicken hear longer takes reservations head kko kko na ra,947,korean,1.27886991616913,103.843822979319,"['68 Tanjong Pagar Rd', 'Singapore 088489', 'Singapore']",3.5,13,$$$
11815,2549.0,2549.0,Kko Kko Na Ra,r2L533c9lFGpjcuUJKY2PA,friday night singapores koreatown small yet flaming brightly eateries busy kko kko nara packed first second floor,947,korean,1.27886991616913,103.843822979319,"['68 Tanjong Pagar Rd', 'Singapore 088489', 'Singapore']",3.5,13,$$$
11816,2550.0,2550.0,Gum Gang Won,11vLDXgUkfIHZZpbe5ww0g,gum gang quaint intimate family restaurant purports serve authentic korean cuisine unlike advertised image food presented,948,korean,1.28324,103.8434677,"['Temple Street 55', 'Chinatown', 'Singapore', 'Singapore']",2.5,3,$$$
11817,2551.0,2551.0,Gum Gang Won,11vLDXgUkfIHZZpbe5ww0g,ordered pot korean stew budae jjigae cost stew completely bland poor quality sausage slices luncheon meat enoki,948,korean,1.28324,103.8434677,"['Temple Street 55', 'Chinatown', 'Singapore', 'Singapore']",2.5,3,$$$
11818,2552.0,2552.0,Gum Gang Won,11vLDXgUkfIHZZpbe5ww0g,like korean restaurants always get great collection small plates delicacies discovered place dfferent,948,korean,1.28324,103.8434677,"['Temple Street 55', 'Chinatown', 'Singapore', 'Singapore']",2.5,3,$$$
11819,2553.0,2553.0,Molly Roffey's Irish Pub,KOc2y0Y2RmHnbih51uxtbA,checked molly roffeys meetup event meet new people singapore around comfortable sitting,949,irish,1.29112759104418,103.856163024902,"['8 Raffles Avenue', '#01-13E Esplanade Mall', 'Singapore 039802', 'Singapore']",4.0,2,$$
11820,2554.0,2554.0,Molly Roffey's Irish Pub,KOc2y0Y2RmHnbih51uxtbA,want perfect place beer see merlion look food bar food pizza fries wings beer cold tall,949,irish,1.29112759104418,103.856163024902,"['8 Raffles Avenue', '#01-13E Esplanade Mall', 'Singapore 039802', 'Singapore']",4.0,2,$$
11821,2555.0,2555.0,Muddy Murphy's,60Y68XJRRXVFSF-wlToDjw,popped friend thanksgivingservice bar slash resturant noise level get high timesthe service normal,950,irish,1.3074175,103.8289161,"['442 Orchard Rd', '#01-02 - 05', 'Singapore 238879', 'Singapore']",4.0,16,$$
11822,2556.0,2556.0,Muddy Murphy's,60Y68XJRRXVFSF-wlToDjw,hidden gem orchard avenue near hilton singapore excellent live music classic rock band fantastic,950,irish,1.3074175,103.8289161,"['442 Orchard Rd', '#01-02 - 05', 'Singapore 238879', 'Singapore']",4.0,16,$$
11823,2557.0,2557.0,Muddy Murphy's,60Y68XJRRXVFSF-wlToDjw,really great service good location lack star review due seating situation probably cant changed much,950,irish,1.3074175,103.8289161,"['442 Orchard Rd', '#01-02 - 05', 'Singapore 238879', 'Singapore']",4.0,16,$$
11824,2558.0,2558.0,O'Briens Irish Sandwich Cafe,-0yVS7oS1vnGOlS7vOrKHg,spot recently opened think replaced small kopitiamfood court tan tock seng hospital ttsh basement know obriens chain,951,irish,1.32127848678982,103.845026462274,"['11-2 Jalan Tan Tock Seng', '#B1-1', 'Singapore 308433', 'Singapore']",3.0,1,$$
15731,2988.0,2988.0,Bochinche,-yvo7tLXZXPwuFPakMZWQQ,top notch service actually made boo boo accidentally change day visit instead time staff alerted mt error app change,1102,argentine,1.28227,103.8476,"['115 Amoy St', '#01-02', 'Singapore 069935', 'Singapore']",4.0,5,$$$
15732,2989.0,2989.0,Bochinche,-yvo7tLXZXPwuFPakMZWQQ,argentinian restaurant singapore must try marked first foray argentinian cuisine open kitchen concept,1102,argentine,1.28227,103.8476,"['115 Amoy St', '#01-02', 'Singapore 069935', 'Singapore']",4.0,5,$$$
15733,2990.0,2990.0,Bochinche,-yvo7tLXZXPwuFPakMZWQQ,chef fabi entire team bochinche incredibly skilled kind partner amazing dinner last weekend started,1102,argentine,1.28227,103.8476,"['115 Amoy St', '#01-02', 'Singapore 069935', 'Singapore']",4.0,5,$$$
